{
  "schema_version": 1,
  "role": "generated_project_capability_registry_do_not_edit",
  "generated_from": [
    {
      "descriptor": "projects/apertured_tube_electron_impact_ion_source/config/project.json",
      "sha256": "D528FF6FB6481620D85D914E1504BE072F94EBC60F52B4DE4C7B388E419A3423"
    },
    {
      "descriptor": "projects/dual_cone_tandem_quadrupole_ion_interface/config/project.json",
      "sha256": "B9F52F6C658B01DF6226F608278FBCA67042D541BC67EB99011BF33DA6FF3256"
    },
    {
      "descriptor": "projects/dual_pressure_rectilinear_ion_processor/config/project.json",
      "sha256": "2F5FD5999CADFF4207229237147A004C09A79B839C4D7EDCAB29E672DDD42210"
    },
    {
      "descriptor": "projects/orthogonal_accelerator/config/project.json",
      "sha256": "A2F1620FBDAE8949A70AB75F89AF73DC76F18569DE98047275651ED471573637"
    },
    {
      "descriptor": "projects/parallel_mirror_dual_stripe_mr_tof/config/project.json",
      "sha256": "C956B6C1F8C6AB9C6603D205A567A54D89300B2D08AE6320D388D677A94EF64C"
    },
    {
      "descriptor": "projects/rf_hexapole_ion_optics/config/project.json",
      "sha256": "318FB3300BB4EBCBE4F66DAA781882E073BFE17D2B3842A4EACAB9FEB49DA6DD"
    },
    {
      "descriptor": "projects/rf_octupole_ion_optics/config/project.json",
      "sha256": "0F48C0340C4C80D1D5BDEEB292DC51E8BBEB226E5C3DC75E3866D664468B4E27"
    },
    {
      "descriptor": "projects/rf_quadrupole_ion_optics/config/project.json",
      "sha256": "8CFB5B07EBDDC1944F3EE0AF5F56B168C98AA6BF4B26AE8DC98F466123C96C8A"
    },
    {
      "descriptor": "projects/single_reflection_oa_tof_mass_analyzer/config/project.json",
      "sha256": "424F9EAABD2F8D99A6AF57D1EC8CA103355FF3137C70E21960494FD3CB1294D9"
    },
    {
      "descriptor": "projects/transverse_helical_filament_wehnelt_electron_gun/config/project.json",
      "sha256": "572DC04628DFB2C49E1D5F0BBC9B372C09A79333EFB3D8EBC5AC7F12F403B1CF"
    }
  ],
  "projects": [
    {
      "schema_version": 1,
      "project_id": "apertured_tube_electron_impact_ion_source",
      "legacy_identities": [
        {
          "mapping_id": "ei_source_rename_20260728",
          "project_id": "electron_impact_ion_source",
          "retired_at_utc": "2026-07-28T08:19:11Z",
          "migration_kind": "administrative_rename_only",
          "artifact_location": {
            "schema_version": 1,
            "state": "archived_verified",
            "archive_id": "20260801_130001__migration-snapshot__repo__electron-impact-ion-source",
            "archive_root": "artifacts/projects/apertured_tube_electron_impact_ion_source/archive/20260801_130001__migration-snapshot__repo__electron-impact-ion-source/legacy-project-root",
            "migration_manifest": "artifacts/projects/apertured_tube_electron_impact_ion_source/archive/20260801_130001__migration-snapshot__repo__electron-impact-ion-source/identity_migration_manifest.json"
          },
          "artifact_access": "read_only",
          "new_runs_allowed": false,
          "verification_identity": "recorded_project_id",
          "claim_policy": "preserve_original_status_and_claim_limits_no_promotion"
        }
      ],
      "family_id": "ion_sources",
      "display_name": "开孔长管电子轰击离子源",
      "purpose": "电子束电离产额可行性以及未来重离子出生接口设计",
      "lifecycle_status": "prototype",
      "toolchains": [
        "comsol",
        "matlab",
        "python"
      ],
      "contracts": {
        "baseline": "config/baseline.json",
        "resolved": "config/resolved_model.json",
        "analysis": null,
        "interface": null,
        "execution": "config/execution_profiles.json",
        "design_variables": null,
        "optimization_envelope": null
      },
      "capabilities": [
        {
          "capability_id": "electron_impact_ionization_feasibility",
          "function": "ionization_yield_feasibility",
          "status": "prototype",
          "modes": [
            "build_only_smoke"
          ],
          "metrics": [
            "ionization_event_count",
            "ionization_yield"
          ],
          "design_variables": []
        }
      ],
      "formal_assets": {
        "status": "none",
        "types": [],
        "identity_contract": null
      },
      "known_gaps": [
        "Functional N=100 GUI Compute and solver-output particle-count verification are not completed",
        "No independent heavy-ion tracking or frozen downstream interface",
        "GUI Compute and native result-node acceptance are not completed"
      ]
    },
    {
      "schema_version": 1,
      "project_id": "dual_cone_tandem_quadrupole_ion_interface",
      "family_id": "atmospheric_pressure_ion_interfaces",
      "display_name": "双锥串联四极杆离子传输接口",
      "purpose": "以COMSOL气流场到SIMION气体辅助轨迹的冻结依赖链验证双锥及两级RF四极导引接口",
      "lifecycle_status": "prototype",
      "toolchains": [
        "comsol",
        "matlab",
        "simion",
        "python"
      ],
      "contracts": {
        "baseline": "config/baseline.json",
        "science": "config/gas_flow_science.json",
        "solver_numerics": "config/comsol_solver_numerics.json",
        "resolved": "config/resolved_geometry.json",
        "analysis": null,
        "interface": "config/gas_field_interface.json",
        "execution": "config/execution_profiles.json",
        "design_variables": null,
        "optimization_envelope": null
      },
      "capabilities": [
        {
          "capability_id": "axisymmetric_gas_flow_field_generation",
          "function": "gas_flow_field_generation",
          "status": "prototype",
          "modes": [
            "axisymmetric_gas_flow_screening"
          ],
          "metrics": [
            "mass_flow_rate",
            "mass_conservation_residual",
            "pressure_range",
            "maximum_gas_speed"
          ],
          "design_variables": []
        },
        {
          "capability_id": "gas_field_driven_simion_transport",
          "function": "gas_assisted_ion_transport",
          "status": "prototype",
          "modes": [
            "gas_field_driven_simion_transport"
          ],
          "metrics": [
            "transmission_fraction",
            "loss_reason_counts",
            "mean_exit_radius",
            "mean_exit_kinetic_energy",
            "mean_residence_time"
          ],
          "design_variables": []
        }
      ],
      "formal_assets": {
        "status": "none",
        "types": [],
        "identity_contract": null
      },
      "known_gaps": [
        "Component vendor and exact product identity are unconfirmed",
        "Cone truncation and aperture-plane interpretation remain provisional; pump geometry and intermediate pressures are missing",
        "The current COMSOL gas-flow model is an axisymmetric empty-enclosure screening model",
        "The registered COMSOL-to-SIMION handoff and uniform-400 Pa control produce only unqualified qualitative Prototype evidence",
        "The current ion source, 570 kHz and 300 V peak-to-ground RF point, and official SIMION SDS collision closure are explicit but not experimentally qualified",
        "CAD, pump type and geometry, intermediate pressure measurements, Candidate evidence and Formal evidence are unavailable"
      ]
    },
    {
      "schema_version": 1,
      "project_id": "dual_pressure_rectilinear_ion_processor",
      "family_id": "rf_ion_accumulation_and_pulsed_extraction",
      "display_name": "双压力区矩形射频离子处理器",
      "purpose": "由简化实体电极与原生SIMION求场复现多极杆输运、捕获、碰撞冷却、聚集、整体抬升和正交引出",
      "lifecycle_status": "prototype",
      "toolchains": [
        "python",
        "simion"
      ],
      "contracts": {
        "baseline": "config/baseline.json",
        "solver_numerics": "config/numerics.json",
        "resolved": null,
        "analysis": "config/acceptance.json",
        "interface": null,
        "execution": null,
        "design_variables": null,
        "optimization_envelope": null
      },
      "capabilities": [
        {
          "capability_id": "native_electrode_functional_transport",
          "function": "ion_capture_cooling_and_extraction",
          "status": "prototype",
          "modes": [],
          "metrics": [
            "capture_fraction",
            "extraction_fraction",
            "hp_mean_kinetic_energy_ev",
            "pre_extraction_slow_sigma_y_mm",
            "extraction_mean_energy_ev"
          ],
          "design_variables": []
        }
      ],
      "formal_assets": {
        "status": "none",
        "types": [],
        "identity_contract": null
      },
      "known_gaps": [
        "Simplified solid-electrode geometry is a functional abstraction, not a complete manufacturer mechanical reconstruction",
        "Native N100 functional baseline and user GUI confirmation are recorded; full spatial and whole-flight time-step convergence remain unqualified",
        "Ion-neutral collision cross section is an uncalibrated placeholder, not a measured N2/524amu value",
        "No fragmentation, space charge, gas-flow solution or manufacturer CAD qualification",
        "COMSOL projection and real upstream multipole handoff remain future work",
        "Analytical prescribed-field code is an unrun reference control, not the production field workflow"
      ]
    },
    {
      "schema_version": 1,
      "project_id": "orthogonal_accelerator",
      "family_id": "orthogonal_pulsed_accelerators",
      "display_name": "正交脉冲加速器（二区／三区结构变体）",
      "purpose": "独立维护正交脉冲加速器的理论、参数化器件几何和验证；向不同TOF仪器提供唯一领域实现",
      "lifecycle_status": "prototype",
      "toolchains": [
        "python",
        "simion",
        "matlab",
        "comsol"
      ],
      "contracts": {
        "baseline": null,
        "resolved": null,
        "analysis": null,
        "interface": "config/component_contract.json",
        "execution": null,
        "design_variables": null,
        "optimization_envelope": null
      },
      "capabilities": [
        {